{
  "schema_version": "1.0",
  "case_id": "esl_2023_2025_v1",
  "created_at": "2026-04-10",
  "last_updated": "2026-04-10",
  "program_identity": {
    "program_code": "ESL",
    "program_name": "Enduro Sahabat Lapas",
    "program_tagline": "Penguatan Keterampilan Mekanik, Kemandirian Usaha, dan Kesiapan Reintegrasi Sosial-Ekonomi bagi WBP dan Eks-WBP",
    "company": "PT Pertamina Lubricants",
    "unit": "TJSL CSV",
    "period_start": 2023,
    "period_end": 2025,
    "palette": "B — Marine Teal"
  },
  "program_positioning": {
    "tjsl_pillar": "Pemberdayaan Masyarakat",
    "sdg_alignment": [
      "SDG 8 — Pekerjaan Layak",
      "SDG 10 — Berkurangnya Ketimpangan",
      "SDG 16 — Perdamaian & Keadilan"
    ],
    "proper_category": "Beyond Compliance — Inovasi Sosial",
    "policy_basis": [
      "UU No. 22 Tahun 2022 tentang Pemasyarakatan",
      "Peraturan Menteri LHK No. 1 Tahun 2021",
      "UU No. 40 Tahun 2007 tentang Perseroan Terbatas Pasal 74"
    ]
  },
  "source_registry": [
    {
      "source_id": "src_01",
      "source_type": "ppt_script",
      "name": "TJSL_Scripts.md — esl_batch1/2/3",
      "parsed_at": "2026-04-10",
      "reliability": "primary"
    },
    {
      "source_id": "src_02",
      "source_type": "ppt_script",
      "name": "TJSL_Scripts.md — esl_slides78 (S10 final)",
      "parsed_at": "2026-04-10",
      "reliability": "primary"
    },
    {
      "source_id": "src_03",
      "source_type": "json",
      "name": "TJSL_Handover.md — ESL section",
      "parsed_at": "2026-04-10",
      "reliability": "primary"
    },
    {
      "source_id": "src_04",
      "source_type": "secondary",
      "name": "Kartu Prakerja — proxy REINT Rp3.500.000/peserta",
      "parsed_at": "2026-04-10",
      "reliability": "secondary"
    },
    {
      "source_id": "src_05",
      "source_type": "secondary",
      "name": "RS Jiwa Grhasia + RSJ Soeharto Heerdjan — proxy CONF Rp50.000/sesi",
      "parsed_at": "2026-04-10",
      "reliability": "secondary"
    }
  ],
  "context_baseline": {
    "region": "Nasional — multi-lokasi",
    "target_area": "Lembaga Pemasyarakatan dan komunitas eks-WBP",
    "population_data": {
      "note": "Data populasi WBP per node belum tersedia secara rinci"
    },
    "socioeconomic": {
      "note": "Konteks sosial-ekonomi umum: WBP menghadapi barrier reintegrasi struktural — stigma, keterbatasan akses kerja, tidak ada modal usaha"
    },
    "data_status": "derived"
  },
  "problem_framing": {
    "problem_tree": [
      {
        "problem_id": "P01",
        "label": "Competency-to-Service Gap",
        "description": "Keterampilan mekanik belum dapat dioperasionalisasikan menjadi layanan bengkel riil yang dapat dijual",
        "barrier_type": "teknis",
        "root_causes": [
          "Pelatihan tidak kontekstual dengan ritme bengkel nyata"
        ]
      },
      {
        "problem_id": "P02",
        "label": "Post-Release Transition Risk",
        "description": "Fase pasca-bebas adalah fase paling rentan tanpa bekal kerja atau usaha yang nyata",
        "barrier_type": "sosial-ekonomi",
        "root_causes": [
          "Tidak ada jalur transisi formal dari Lapas ke pasar kerja"
        ]
      },
      {
        "problem_id": "P03",
        "label": "Entrepreneurship Gap",
        "description": "Kemampuan mekanik belum berkembang menjadi kapasitas usaha",
        "barrier_type": "kapasitas",
        "root_causes": [
          "Tidak ada pendampingan pengelolaan usaha"
        ]
      },
      {
        "problem_id": "P04",
        "label": "Social Acceptance & Market Linkage",
        "description": "Reintegrasi membutuhkan penerimaan sosial, jejaring, dan akses pasar",
        "barrier_type": "sosial",
        "root_causes": [
          "Stigma eks-WBP di pasar kerja formal"
        ]
      }
    ],
    "barrier_types": [
      "teknis",
      "sosial-ekonomi",
      "kapasitas",
      "sosial"
    ],
    "data_status": "derived"
  },
  "ideal_conditions": {
    "vision_statement": "Ekosistem produktif berbasis bengkel otomotif yang memungkinkan WBP dan eks-WBP bekerja mandiri dan berintegrasi kembali ke masyarakat",
    "target_outcomes": [
      "Keterampilan mekanik terkonversi menjadi layanan bengkel riil",
      "Eks-WBP memiliki usaha atau pekerjaan legal pasca-bebas",
      "Reintegrasi sosial-ekonomi terukur dan berkelanjutan"
    ],
    "key_improvements": [
      "Hard skill mekanik otomotif",
      "Kapasitas wirausaha bengkel",
      "Kesiapan reintegrasi sosial-ekonomi",
      "Kepercayaan diri dan self-efficacy"
    ],
    "data_status": "derived"
  },
  "strategy_design": {
    "program_philosophy": "Intervensi vokasional produktif berbasis bengkel otomotif dengan jalur transisi langsung dari pembinaan di Lapas menuju usaha mandiri pasca-bebas",
    "roadmap": [
      {
        "stage_id": "S1",
        "label": "Pembentukan Kapasitas",
        "period": "2023",
        "focus": "Pelatihan mekanik dasar + product knowledge pelumas",
        "loop_type": "single"
      },
      {
        "stage_id": "S2",
        "label": "Penguatan Operasional",
        "period": "2024",
        "focus": "Praktik bengkel riil + pembinaan kewirausahaan",
        "loop_type": "double"
      },
      {
        "stage_id": "S3",
        "label": "Stabilisasi & Ekspansi",
        "period": "2025",
        "focus": "Penguatan node eks-WBP + Lapas Corner + pipeline reintegrasi",
        "loop_type": "double"
      }
    ],
    "value_chain": [
      "Pelatihan teknis mekanik",
      "Product knowledge pelumas Enduro",
      "Praktik bengkel & servis riil",
      "Pembinaan kewirausahaan",
      "Pendampingan unit usaha"
    ],
    "institutional": {
      "nodes": [
        "Lapas Palembang",
        "Bengkel Lapas IIB Sleman",
        "Milenial Motor (Eks-WBP)",
        "Pemasyarakatan Corner"
      ],
      "note": "4 node, 3 aktif bertransaksi, 1 dalam fase pembentukan"
    },
    "data_status": "observed"
  },
  "activities": [
    {
      "activity_id": "ACT_01",
      "name": "Pelatihan Teknis Mekanik",
      "year": 2023,
      "description": "Servis ringan, penggantian oli, pemeriksaan komponen dasar",
      "data_status": "observed"
    },
    {
      "activity_id": "ACT_02",
      "name": "Product Knowledge Pelumas",
      "year": 2023,
      "description": "Edukasi jenis dan fungsi pelumas, integrasi produk Enduro",
      "data_status": "observed"
    },
    {
      "activity_id": "ACT_03",
      "name": "Praktik Kerja Perbengkelan",
      "year": 2023,
      "description": "Simulasi layanan bengkel dalam kondisi nyata",
      "data_status": "observed"
    },
    {
      "activity_id": "ACT_04",
      "name": "Pembinaan Kewirausahaan",
      "year": 2024,
      "description": "Dasar pengelolaan bengkel, harga jasa, stok, pelayanan pelanggan",
      "data_status": "observed"
    },
    {
      "activity_id": "ACT_05",
      "name": "Pendampingan Unit Usaha",
      "year": 2024,
      "description": "Penguatan bengkel Lapas, corner, dan bengkel eks-WBP",
      "data_status": "observed"
    },
    {
      "activity_id": "ACT_06",
      "name": "Penguatan Milenial Motor",
      "year": 2025,
      "description": "Penguatan node eks-WBP sebagai proof-of-concept reintegrasi",
      "data_status": "observed"
    }
  ],
  "outputs": [
    {
      "output_id": "OUT_01",
      "name": "Node aktif bertransaksi",
      "year": 2023,
      "quantity": 3,
      "unit": "node",
      "activity_refs": [
        "ACT_01",
        "ACT_02",
        "ACT_03"
      ],
      "data_status": "observed"
    },
    {
      "output_id": "OUT_02",
      "name": "Node aktif bertransaksi",
      "year": 2024,
      "quantity": 3,
      "unit": "node",
      "activity_refs": [
        "ACT_04",
        "ACT_05"
      ],
      "data_status": "observed"
    },
    {
      "output_id": "OUT_03",
      "name": "Node aktif bertransaksi",
      "year": 2025,
      "quantity": 3,
      "unit": "node",
      "activity_refs": [
        "ACT_06"
      ],
      "data_status": "observed"
    },
    {
      "output_id": "OUT_04",
      "name": "Peserta program (estimasi)",
      "year": 2023,
      "quantity": 70,
      "unit": "peserta",
      "activity_refs": [
        "ACT_01"
      ],
      "data_status": "proxy"
    },
    {
      "output_id": "OUT_05",
      "name": "Peserta program (estimasi)",
      "year": 2024,
      "quantity": 70,
      "unit": "peserta",
      "activity_refs": [
        "ACT_04"
      ],
      "data_status": "proxy"
    },
    {
      "output_id": "OUT_06",
      "name": "Peserta program (estimasi)",
      "year": 2025,
      "quantity": 80,
      "unit": "peserta",
      "activity_refs": [
        "ACT_06"
      ],
      "data_status": "proxy"
    }
  ],
  "stakeholders": [
    {
      "stakeholder_id": "STK_01",
      "name": "PT Pertamina Lubricants",
      "role": "investor",
      "inclusion_basis": "Pemrakarsa dan penyelenggara program TJSL"
    },
    {
      "stakeholder_id": "STK_02",
      "name": "WBP aktif di Lapas",
      "role": "beneficiary",
      "inclusion_basis": "Penerima pelatihan langsung"
    },
    {
      "stakeholder_id": "STK_03",
      "name": "Eks-WBP (Milenial Motor)",
      "role": "beneficiary",
      "inclusion_basis": "Penerima manfaat reintegrasi — usaha mandiri"
    },
    {
      "stakeholder_id": "STK_04",
      "name": "Lembaga Pemasyarakatan",
      "role": "partner",
      "inclusion_basis": "Penyelenggara ruang pelatihan"
    },
    {
      "stakeholder_id": "STK_05",
      "name": "Pelanggan Bengkel",
      "role": "beneficiary",
      "inclusion_basis": "Pengguna jasa servis dan pelumas"
    }
  ],
  "beneficiaries": [
    {
      "group_id": "BNF_01",
      "name": "WBP peserta pelatihan",
      "count": 70,
      "count_basis": "Estimasi konservatif S10: 10 peserta per node aktif × 3 node + 4 dari Lapas Palembang",
      "data_status": "proxy"
    },
    {
      "group_id": "BNF_02",